{
  "schema_version": "generic.external_event.v1",
  "adapter_id": "generic.external_event.v1",
  "event_id": "example-github-repo-workflow-run-completed",
  "observed_at": "2026-06-16T00:00:00Z",
  "event_type": "github.actions.workflow_run.completed",
  "actor": "github-actions[bot]",
  "source_ref": "examples/github-repo-trust-surface/.atlas/events/github-actions-run-event.json",
  "subject": {
    "type": "github-actions-workflow-run",
    "ref": "owner/example-repo/actions/runs/1000000001"
  },
  "evidence_refs": [
    "docs/reviews/GITHUB_ACTIONS_RUN_RECEIPT_CANDIDATE_M151.md",
    "schemas/generic-external-event.v1.schema.json",
    "github-actions://repository/owner/example-repo",
    "github-actions://workflow/atlas-metadata-receipts",
    "github-actions://run/1000000001",
    "github-actions://head_sha/0123456789abcdef0123456789abcdef01234567",
    "github-actions://conclusion/success"
  ],
  "artifact_refs": [],
  "approval_refs": [],
  "metadata_only": true,
  "raw_artifacts_embedded": false,
  "known_limitations": [
    "Example GitHub Actions metadata sample only; Atlas does not call GitHub or verify that this run exists.",
    "The event does not embed workflow logs, check annotations, artifacts, webhook payloads, credentials, or secrets.",
    "A receipt proves local metadata shape, deterministic receipt hashing, and replay linkage only; it does not prove source-system truth, run correctness, authorization, or production approval."
  ]
}
