{
  "schema_version": "generic.external_event.v1",
  "adapter_id": "generic.external_event.v1",
  "event_id": "example-github-repo-check-run-completed",
  "observed_at": "2026-06-16T00:01:00Z",
  "event_type": "github.actions.check_run.completed",
  "actor": "github-actions[bot]",
  "source_ref": "examples/github-repo-trust-surface/.atlas/events/github-actions-check-event.json",
  "subject": {
    "type": "github-actions-check-run",
    "ref": "owner/example-repo/check-runs/1000000002"
  },
  "evidence_refs": [
    "docs/reviews/GITHUB_ACTIONS_RUN_RECEIPT_CANDIDATE_M151.md",
    "schemas/generic-external-event.v1.schema.json",
    "github-actions://repository/owner/example-repo",
    "github-actions://run/1000000001",
    "github-actions://check_run/1000000002",
    "github-actions://check_name/atlas-metadata-receipts",
    "github-actions://conclusion/success"
  ],
  "artifact_refs": [],
  "approval_refs": [],
  "metadata_only": true,
  "raw_artifacts_embedded": false,
  "known_limitations": [
    "Example GitHub Actions check metadata sample only; Atlas does not call GitHub or verify that this check exists.",
    "The event does not embed check logs, annotations, artifacts, webhook payloads, credentials, or secrets.",
    "A receipt proves local metadata shape, deterministic receipt hashing, and replay linkage only; it does not prove source-system truth, check correctness, authorization, or production approval."
  ]
}
